<?xml version="1.0" encoding="UTF-8"?>
<!DOCTYPE pedidos SYSTEM "file:/C:/Users/Campus%20FP/Desktop/carlos/Lenguaje_de_marcas/H2_T2/H2_T2_LM_Carlos_de_Alda.dtd">
<pedidos>
  <!-- Año 2021 -->
  <anio año="2021">
    <!-- Primer Trimestre -->
    <trimestre numero="1">
      <!-- Pedido 1 -->
      <pedido>
        <nombre>María</nombre>
        <apellidos>González Martínez</apellidos>
        <telefono>654987321</telefono>
        <direccion>
          <calle>Calle Gran Vía, 789</calle>
          <ciudad>Barcelona</ciudad>
          <codigo_postal>08003</codigo_postal>
          <provincia>Barcelona</provincia>
        </direccion>
        <correo>maria@example.com</correo>
        <fecha_inclusion>2020-12-05</fecha_inclusion>
        <pedido_detalle>
          <numero_pedido>1</numero_pedido>
          <fecha_compra>2021-01-03</fecha_compra>
          <fecha_entrega>2021-01-13</fecha_entrega>
          <total_factura>90.00</total_factura>
          <productos>
            <producto>
              <nombre>Chaqueta de Cuero Zara</nombre>
              <referencia>ZR001</referencia>
              <precio>60.00</precio>
              <unidades>1</unidades>
            </producto>
            <producto>
              <nombre>Pantalón Vaquero Stradivarius</nombre>
              <referencia>SV001</referencia>
              <precio>30.00</precio>
              <unidades>1</unidades>
            </producto>
          </productos>
        </pedido_detalle>
      </pedido>
      
      <!-- Pedido 2 -->
      <pedido>
        <nombre>José</nombre>
        <apellidos>Ruiz Sánchez</apellidos>
        <telefono>678123789</telefono>
        <direccion>
          <calle>Calle Mayor, 789</calle>
          <ciudad>Madrid</ciudad>
          <codigo_postal>28004</codigo_postal>
          <provincia>Madrid</provincia>
        </direccion>
        <correo>jose@example.com</correo>
        <fecha_inclusion>2020-11-25</fecha_inclusion>
        <pedido_detalle>
          <numero_pedido>2</numero_pedido>
          <fecha_compra>2021-01-06</fecha_compra>
          <fecha_entrega>2021-01-16</fecha_entrega>
          <total_factura>200.00</total_factura>
          <productos>
            <producto>
              <nombre>Zapatillas Adidas Superstar</nombre>
              <referencia>AS002</referencia>
              <precio>90.00</precio>
              <unidades>2</unidades>
            </producto>
            <producto>
              <nombre>Jersey HyM</nombre>
              <referencia>HM001</referencia>
              <precio>20.00</precio>
              <unidades>1</unidades>
            </producto>
          </productos>
        </pedido_detalle>
      </pedido>
      
      <!-- Pedido 3 -->
      <pedido>
        <nombre>Andrea</nombre>
        <apellidos>Fernández Gutiérrez</apellidos>
        <telefono>654789123</telefono>
        <direccion>
          <calle>Calle Sevilla, 456</calle>
          <ciudad>Valencia</ciudad>
          <codigo_postal>46002</codigo_postal>
          <provincia>Valencia</provincia>
        </direccion>
        <correo>andrea@example.com</correo>
        <fecha_inclusion>2020-12-15</fecha_inclusion>
        <pedido_detalle>
          <numero_pedido>3</numero_pedido>
          <fecha_compra>2021-01-10</fecha_compra>
          <fecha_entrega>2021-01-20</fecha_entrega>
          <total_factura>80.00</total_factura>
          <productos>
            <producto>
              <nombre>Camiseta Manga Corta PullandBear</nombre>
              <referencia>PB001</referencia>
              <precio>30.00</precio>
              <unidades>1</unidades>
            </producto>
            <producto>
              <nombre>Short Deportivo Nike</nombre>
              <referencia>NK003</referencia>
              <precio>50.00</precio>
              <unidades>1</unidades>
            </producto>
          </productos>
        </pedido_detalle>
      </pedido>
      
      <!-- Pedido 4 -->
      <pedido>
        <nombre>Laura</nombre>
        <apellidos>Rodríguez Martínez</apellidos>
        <telefono>678321654</telefono>
        <direccion>
          <calle>Calle Granada, 789</calle>
          <ciudad>Sevilla</ciudad>
          <codigo_postal>41002</codigo_postal>
          <provincia>Sevilla</provincia>
        </direccion>
        <correo>laura@example.com</correo>
        <fecha_inclusion>2020-11-30</fecha_inclusion>
        <pedido_detalle>
          <numero_pedido>4</numero_pedido>
          <fecha_compra>2021-01-12</fecha_compra>
          <fecha_entrega>2021-01-22</fecha_entrega>
          <total_factura>150.00</total_factura>
          <productos>
            <producto>
              <nombre>Botas Timberland</nombre>
              <referencia>TM001</referencia>
              <precio>100.00</precio>
              <unidades>1</unidades>
            </producto>
            <producto>
              <nombre>Bufanda Mango</nombre>
              <referencia>MG001</referencia>
              <precio>50.00</precio>
              <unidades>1</unidades>
            </producto>
          </productos>
        </pedido_detalle>
      </pedido>
      
      <!-- Pedido 5 -->
      <pedido>
        <nombre>Pedro</nombre>
        <apellidos>Martínez Sánchez</apellidos>
        <telefono>987321654</telefono>
        <direccion>
          <calle>Calle Mayor, 123</calle>
          <ciudad>Barcelona</ciudad>
          <codigo_postal>08001</codigo_postal>
          <provincia>Barcelona</provincia>
        </direccion>
        <correo>pedro@example.com</correo>
        <fecha_inclusion>2020-12-20</fecha_inclusion>
        <pedido_detalle>
          <numero_pedido>5</numero_pedido>
          <fecha_compra>2021-01-15</fecha_compra>
          <fecha_entrega>2021-01-25</fecha_entrega>
          <total_factura>95.00</total_factura>
          <productos>
            <producto>
              <nombre>Sudadera GAP</nombre>
              <referencia>GP001</referencia>
              <precio>70.00</precio>
              <unidades>1</unidades>
            </producto>
            <producto>
              <nombre>Gorra New Era</nombre>
              <referencia>NE001</referencia>
              <precio>25.00</precio>
              <unidades>1</unidades>
            </producto>
          </productos>
        </pedido_detalle>
      </pedido>
      
      <!-- Pedido 6 -->
      <pedido>
        <nombre>Ana</nombre>
        <apellidos>López García</apellidos>
        <telefono>654321789</telefono>
        <direccion>
          <calle>Calle Sevilla, 123</calle>
          <ciudad>Madrid</ciudad>
          <codigo_postal>28005</codigo_postal>
          <provincia>Madrid</provincia>
        </direccion>
        <correo>ana@example.com</correo>
        <fecha_inclusion>2020-11-15</fecha_inclusion>
        <pedido_detalle>
          <numero_pedido>6</numero_pedido>
          <fecha_compra>2021-01-18</fecha_compra>
          <fecha_entrega>2021-01-28</fecha_entrega>
          <total_factura>130.00</total_factura>
          <productos>
            <producto>
              <nombre>Jersey Massimo Dutti</nombre>
              <referencia>MD001</referencia>
              <precio>80.00</precio>
              <unidades>1</unidades>
            </producto>
            <producto>
              <nombre>Jeans Levi's</nombre>
              <referencia>LV002</referencia>
              <precio>50.00</precio>
              <unidades>1</unidades>
            </producto>
          </productos>
        </pedido_detalle>
      </pedido>
      
      <!-- Pedido 7 -->
      <pedido>
        <nombre>David</nombre>
        <apellidos>Pérez Rodríguez</apellidos>
        <telefono>321987654</telefono>
        <direccion>
          <calle>Calle Alameda, 456</calle>
          <ciudad>Valencia</ciudad>
          <codigo_postal>46003</codigo_postal>
          <provincia>Valencia</provincia>
        </direccion>
        <correo>david@example.com</correo>
        <fecha_inclusion>2020-12-01</fecha_inclusion>
        <pedido_detalle>
          <numero_pedido>7</numero_pedido>
          <fecha_compra>2021-01-20</fecha_compra>
          <fecha_entrega>2021-01-30</fecha_entrega>
          <total_factura>70.00</total_factura>
          <productos>
            <producto>
              <nombre>Camiseta Vans</nombre>
              <referencia>VN001</referencia>
              <precio>40.00</precio>
              <unidades>1</unidades>
            </producto>
            <producto>
              <nombre>Calcetines HUF</nombre>
              <referencia>HU001</referencia>
              <precio>30.00</precio>
              <unidades>1</unidades>
            </producto>
          </productos>
        </pedido_detalle>
      </pedido>
      
      <!-- Pedido 8 -->
      <pedido>
        <nombre>Isabel</nombre>
        <apellidos>Martínez Pérez</apellidos>
        <telefono>321654987</telefono>
        <direccion>
          <calle>Calle Granada, 123</calle>
          <ciudad>Madrid</ciudad>
          <codigo_postal>28006</codigo_postal>
          <provincia>Madrid</provincia>
        </direccion>
        <correo>isabel@example.com</correo>
        <fecha_inclusion>2020-11-10</fecha_inclusion>
        <pedido_detalle>
          <numero_pedido>8</numero_pedido>
          <fecha_compra>2021-01-22</fecha_compra>
          <fecha_entrega>2021-02-01</fecha_entrega>
          <total_factura>100.00</total_factura>
          <productos>
            <producto>
              <nombre>Chaqueta Helly Hansen</nombre>
              <referencia>HH001</referencia>
              <precio>80.00</precio>
              <unidades>1</unidades>
            </producto>
            <producto>
              <nombre>Bufanda Zara</nombre>
              <referencia>ZR002</referencia>
              <precio>20.00</precio>
              <unidades>1</unidades>
            </producto>
          </productos>
        </pedido_detalle>
      </pedido>
      
      <!-- Pedido 9 -->
      <pedido>
        <nombre>Miguel</nombre>